{
  "schema_version": "0.1",
  "seed": 0,
  "configuration": {
    "dataset": "OmniDocBench_demo",
    "dataset_revision": "193627ae9e97d89188468ed1ee3b7a856ff76044",
    "dataset_scope": "all_18_official_demo_pages",
    "evaluation_lane": "oracle_reconstruction",
    "warning": "Ground-truth Markdown and geometry isolate reconstruction; this is not an OCR or parser benchmark.",
    "docreconstruct_revision": "11321aa920917b8c946dec6c5a95fe0f6fa1127e",
    "oracle_conversion_spec": "omnidocbench-demo-to-canonical-ir/0.1"
  },
  "job_options": {
    "strict_evidence": true,
    "allow_remote_assets": false,
    "save_render_artifacts": false
  },
  "cases": [
    {
      "id": "odb-demo-00-yanbaopptmerge_SE05.pdf_7",
      "original_layout": "private/OmniDocBench/demo_data/omnidocbench_demo/images/yanbaopptmerge_SE05.pdf_7.jpg",
      "reviewed_markdown": "private/OmniDocBench/demo_data/omnidocbench_demo/mds/yanbaopptmerge_SE05.pdf_7.md",
      "evidence": [
        {
          "path": "private/canonical/yanbaopptmerge_SE05.pdf_7.canonical.json",
          "provider": "json"
        }
      ],
      "tags": {
        "language": "english",
        "scripts": [
          "latin"
        ],
        "document_type": "PPT2PDF",
        "degradations": [
          "colorful_backgroud"
        ],
        "content_kinds": [
          "text",
          "single_column"
        ]
      },
      "metadata": {
        "upstream_image": "yanbaopptmerge_SE05.pdf_7.jpg",
        "upstream_page_no": 7,
        "upstream_layout": "single_column",
        "oracle_inputs": true,
        "dataset_revision": "193627ae9e97d89188468ed1ee3b7a856ff76044",
        "license_lane": "research-only"
      }
    },
    {
      "id": "odb-demo-01-yanbaopptmerge_yanbaoPPT_145",
      "original_layout": "private/OmniDocBench/demo_data/omnidocbench_demo/images/yanbaopptmerge_yanbaoPPT_145.jpg",
      "reviewed_markdown": "private/OmniDocBench/demo_data/omnidocbench_demo/mds/yanbaopptmerge_yanbaoPPT_145.md",
      "evidence": [
        {
          "path": "private/canonical/yanbaopptmerge_yanbaoPPT_145.canonical.json",
          "provider": "json"
        }
      ],
      "tags": {
        "language": "simplified_chinese",
        "scripts": [
          "han"
        ],
        "document_type": "PPT2PDF",
        "degradations": [
          "colorful_backgroud"
        ],
        "content_kinds": [
          "text",
          "single_column"
        ]
      },
      "metadata": {
        "upstream_image": "yanbaopptmerge_yanbaoPPT_145.jpg",
        "upstream_page_no": 145,
        "upstream_layout": "single_column",
        "oracle_inputs": true,
        "dataset_revision": "193627ae9e97d89188468ed1ee3b7a856ff76044",
        "license_lane": "research-only"
      }
    },
    {
      "id": "odb-demo-02-docstructbench_llm-raw-scihub-o.O-j.chroma.2005.05.085.pdf_4",
      "original_layout": "private/OmniDocBench/demo_data/omnidocbench_demo/images/docstructbench_llm-raw-scihub-o.O-j.chroma.2005.05.085.pdf_4.jpg",
      "reviewed_markdown": "private/OmniDocBench/demo_data/omnidocbench_demo/mds/docstructbench_llm-raw-scihub-o.O-j.chroma.2005.05.085.pdf_4.md",
      "evidence": [
        {
          "path": "private/canonical/docstructbench_llm-raw-scihub-o.O-j.chroma.2005.05.085.pdf_4.canonical.json",
          "provider": "json"
        }
      ],
      "tags": {
        "language": "english",
        "scripts": [
          "latin"
        ],
        "document_type": "academic_literature",
        "degradations": [
          "table_fewer_line",
          "table_horizontal",
          "table_span",
          "table_with_formula"
        ],
        "content_kinds": [
          "text",
          "table",
          "double_column"
        ]
      },
      "metadata": {
        "upstream_image": "docstructbench_llm-raw-scihub-o.O-j.chroma.2005.05.085.pdf_4.jpg",
        "upstream_page_no": 4,
        "upstream_layout": "double_column",
        "oracle_inputs": true,
        "dataset_revision": "193627ae9e97d89188468ed1ee3b7a856ff76044",
        "license_lane": "research-only"
      }
    },
    {
      "id": "odb-demo-03-docstructbench_llm-raw-scihub-o.O-j.physletb.2004.06.101.pdf_3",
      "original_layout": "private/OmniDocBench/demo_data/omnidocbench_demo/images/docstructbench_llm-raw-scihub-o.O-j.physletb.2004.06.101.pdf_3.jpg",
      "reviewed_markdown": "private/OmniDocBench/demo_data/omnidocbench_demo/mds/docstructbench_llm-raw-scihub-o.O-j.physletb.2004.06.101.pdf_3.md",
      "evidence": [
        {
          "path": "private/canonical/docstructbench_llm-raw-scihub-o.O-j.physletb.2004.06.101.pdf_3.canonical.json",
          "provider": "json"
        }
      ],
      "tags": {
        "language": "english",
        "scripts": [
          "latin"
        ],
        "document_type": "academic_literature",
        "degradations": [
          "None"
        ],
        "content_kinds": [
          "text",
          "formula",
          "single_column"
        ]
      },
      "metadata": {
        "upstream_image": "docstructbench_llm-raw-scihub-o.O-j.physletb.2004.06.101.pdf_3.jpg",
        "upstream_page_no": 3,
        "upstream_layout": "single_column",
        "oracle_inputs": true,
        "dataset_revision": "193627ae9e97d89188468ed1ee3b7a856ff76044",
        "license_lane": "research-only"
      }
    },
    {
      "id": "odb-demo-04-docstructbench_dianzishu_zhongwenzaixian-o.O-60599898.pdf_30",
      "original_layout": "private/OmniDocBench/demo_data/omnidocbench_demo/images/docstructbench_dianzishu_zhongwenzaixian-o.O-60599898.pdf_30.jpg",
      "reviewed_markdown": "private/OmniDocBench/demo_data/omnidocbench_demo/mds/docstructbench_dianzishu_zhongwenzaixian-o.O-60599898.pdf_30.md",
      "evidence": [
        {
          "path": "private/canonical/docstructbench_dianzishu_zhongwenzaixian-o.O-60599898.pdf_30.canonical.json",
          "provider": "json"
        }
      ],
      "tags": {
        "language": "simplified_chinese",
        "scripts": [
          "han"
        ],
        "document_type": "book",
        "degradations": [
          "None"
        ],
        "content_kinds": [
          "text",
          "double_column"
        ]
      },
      "metadata": {
        "upstream_image": "docstructbench_dianzishu_zhongwenzaixian-o.O-60599898.pdf_30.jpg",
        "upstream_page_no": 30,
        "upstream_layout": "double_column",
        "oracle_inputs": true,
        "dataset_revision": "193627ae9e97d89188468ed1ee3b7a856ff76044",
        "license_lane": "research-only"
      }
    },
    {
      "id": "odb-demo-05-docstructbench_dianzishu_zhongwenzaixian-o.O-61522235.pdf_170",
      "original_layout": "private/OmniDocBench/demo_data/omnidocbench_demo/images/docstructbench_dianzishu_zhongwenzaixian-o.O-61522235.pdf_170.jpg",
      "reviewed_markdown": "private/OmniDocBench/demo_data/omnidocbench_demo/mds/docstructbench_dianzishu_zhongwenzaixian-o.O-61522235.pdf_170.md",
      "evidence": [
        {
          "path": "private/canonical/docstructbench_dianzishu_zhongwenzaixian-o.O-61522235.pdf_170.canonical.json",
          "provider": "json"
        }
      ],
      "tags": {
        "language": "simplified_chinese",
        "scripts": [
          "han"
        ],
        "document_type": "book",
        "degradations": [
          "table_horizontal",
          "table_omission_line",
          "table_span"
        ],
        "content_kinds": [
          "text",
          "table",
          "figure",
          "single_column"
        ]
      },
      "metadata": {
        "upstream_image": "docstructbench_dianzishu_zhongwenzaixian-o.O-61522235.pdf_170.jpg",
        "upstream_page_no": 170,
        "upstream_layout": "single_column",
        "oracle_inputs": true,
        "dataset_revision": "193627ae9e97d89188468ed1ee3b7a856ff76044",
        "license_lane": "research-only"
      }
    },
    {
      "id": "odb-demo-06-docstructbench_dianzishu_zhongwenzaixian-o.O-61520814.pdf_185",
      "original_layout": "private/OmniDocBench/demo_data/omnidocbench_demo/images/docstructbench_dianzishu_zhongwenzaixian-o.O-61520814.pdf_185.jpg",
      "reviewed_markdown": "private/OmniDocBench/demo_data/omnidocbench_demo/mds/docstructbench_dianzishu_zhongwenzaixian-o.O-61520814.pdf_185.md",
      "evidence": [
        {
          "path": "private/canonical/docstructbench_dianzishu_zhongwenzaixian-o.O-61520814.pdf_185.canonical.json",
          "provider": "json"
        }
      ],
      "tags": {
        "language": "simplified_chinese",
        "scripts": [
          "han"
        ],
        "document_type": "magazine",
        "degradations": [
          "table_omission_line",
          "table_horizontal",
          "table_span",
          "table_with_formula"
        ],
        "content_kinds": [
          "text",
          "table",
          "figure"
        ]
      },
      "metadata": {
        "upstream_image": "docstructbench_dianzishu_zhongwenzaixian-o.O-61520814.pdf_185.jpg",
        "upstream_page_no": 41,
        "upstream_layout": "other_layout",
        "oracle_inputs": true,
        "dataset_revision": "193627ae9e97d89188468ed1ee3b7a856ff76044",
        "license_lane": "research-only"
      }
    },
    {
      "id": "odb-demo-07-docstructbench_dianzishu_zhongwenzaixian-o.O-61569294.pdf_128",
      "original_layout": "private/OmniDocBench/demo_data/omnidocbench_demo/images/docstructbench_dianzishu_zhongwenzaixian-o.O-61569294.pdf_128.jpg",
      "reviewed_markdown": "private/OmniDocBench/demo_data/omnidocbench_demo/mds/docstructbench_dianzishu_zhongwenzaixian-o.O-61569294.pdf_128.md",
      "evidence": [
        {
          "path": "private/canonical/docstructbench_dianzishu_zhongwenzaixian-o.O-61569294.pdf_128.canonical.json",
          "provider": "json"
        }
      ],
      "tags": {
        "language": "simplified_chinese",
        "scripts": [
          "han"
        ],
        "document_type": "magazine",